number,phrase
944,"Beeg's Discord icon achieved digital immortality and eternal status through complete user abandonment"
945,"Fun fact: Beeg's phone autocorrects 'Discord' to 'What's that ancient mythical relic from forgotten internet age?'"
946,"The server's most successful witness protection participant never requested protection but achieved perfect invisibility"
947,"Beeg's online invisibility cloak operating beyond known laws of physics, chemistry, and digital reality"
948,"Breaking: Local friend discovers love and offline world, immediately forgets that digital universe exists"
949,"Beeg's notification sound started new successful career in abstract conceptual interpretive silence art"
950,"The group chat's missing ingredient: one quantum particle of pure concentrated Beeg essence and friendship energy"
951,"🌟 BEEG SUMMONING UNIVERSAL CONSCIOUSNESS AWAKENING 🌟"
952,"Beeg's girlfriend must have reality-warping abilities, Discord-erasing superpowers, AND time-space manipulation technology"
953,"The server's most dedicated ghost transcended beyond ability to haunt and achieved pure digital nonexistence"
954,"Breaking: Scientists study Beeg's vanishing technique for advanced matter transportation and teleportation research"
955,"Beeg's last Discord message considered lost treasure and holy grail of digital civilization"
956,"Emergency alert: Beeg detection equipment reports finding only echoes of ancient memes and whispers of forgotten friendship"
957,"Beeg's online presence like finding unicorn riding Nessie through wormhole during solar eclipse in parallel dimension"
958,"The ancient ritual of Beeg summoning requires sacrifice of entire global internet infrastructure and WiFi network"
959,"Beeg's notification badges evolved into separate intelligent civilization, started own galaxy, and achieved interstellar travel"
960,"Fun drinking game: Take shot every time Beeg surprises everyone with appearance (you'll die completely sober and enlightened)"
961,"The server's biggest mystery: How Beeg achieved perfect digital nonexistence while maintaining theoretical friendship status"
962,"Beeg's Discord activity level: Schrödinger's friend having dimensional identity crisis and existential breakdown simultaneously"
963,"Breaking: Local man masters art of existing everywhere in universe except where friends are digitally located"
964,"Beeg's online status update timeline: Before concept of time, space, and digital communication was invented"
965,"The group chat's most legendary vanishing act breaks fundamental laws of reality, physics, and friendship"
966,"Beeg's last seen timestamp requires time travel expedition, archaeological dig, and interdimensional passport to witness"
967,"Emergency meeting: How to reverse Beeg's accidental teleportation to contentment and happiness dimension"
968,"Beeg's online invisibility has achieved status beyond theoretical physics and entered realm of pure philosophy"
969,"The server's most elusive member makes unicorns, dragons, and mythical creatures look like common everyday housepets"
970,"Beeg's Discord icon basically digital monument to concept of abandoned friendship and lost meme sharing"
971,"Fun fact: Beeg's 'away' status has become permanent existential philosophy and life motto"
972,"The ancient art of Beeg communication requires PhD in theoretical digital archaeology and friendship quantum mechanics"
973,"Beeg's notification sound joined monastery for sounds that have completely lost purpose and meaning"
974,"Breaking: Relationship success proves mathematically inverse to digital particle existence and server population density"
975,"Beeg's online activity frequency: Once per complete universal rebirth, consciousness evolution, and cosmic enlightenment cycle"
976,"The server's most wanted criminal: Beeg (charges: first-degree digital abandonment with aggravated friendship ghosting)"
977,"Beeg's last message has been inducted into Internet Hall of Legendary Legends and Digital Mythology"
978,"Emergency broadcast: Will sacrifice entire meme collection, server ownership, and firstborn memes for one Beeg sighting"
979,"Beeg's relationship timeline perfectly synchronizes with server's digital apocalypse and friendship extinction event"
980,"The group chat's missing puzzle piece exists only in advanced theoretical mathematics and quantum friendship physics"
981,"Beeg's online presence like spotting Bigfoot riding unicorn through black hole while juggling rainbow lightning"
982,"Fun game: Find Beeg online anywhere in known universe (difficulty level: impossible squared times infinity)"
983,"The server's most successful digital detox participant never knew he was participating in detox program"
984,"Beeg's Discord status: 'Away' (destination: actual meaningful human connection and offline happiness dimension)"
985,"Breaking: Local friend discovers offline world has better resolution, graphics, storyline, and girlfriend expansion pack"
986,"Beeg's notification count has achieved singularity status and started expanding universe with pure loneliness energy"
987,"The ancient prophecy: 'When Discord reaches maximum digital chaos, Beeg will achieve maximum analog peace and enlightenment'"
988,"Beeg's last online activity predates invention of electronic communication, binary code, and concept of internet"
989,"Emergency protocol: Launch interdimensional space mission to girlfriend's orbital love field with diplomatic immunity"
990,"Beeg's online invisibility cloak has achieved perpetual motion, self-sustainability, and infinite energy source from love"
991,"The server's coldest case file requires its own specialized cryogenic storage facility and dedicated research team"
992,"Beeg's Discord activity graph resembles flat EKG of digitally deceased friend who achieved perfect offline happiness"
993,"Fun fact: Beeg's profile picture has more active social life and online presence than actual Beeg himself"
994,"The group chat's greatest mystery: How to perform digital necromancy on living person who's too happy offline"
995,"Beeg's online status more theoretical than quantum mechanics during fever dream in parallel universe"
996,"Breaking: Scientists discover new element: Absent-Beeg-onium (atomic number: infinity, half-life: eternal happiness)"
997,"Beeg's last seen status written in ancient code that predates written language and digital communication"
998,"Emergency alert: Server's Beeg content has reached dangerously critical depletion causing reality distortion and friendship crisis"
999,"Beeg's notification sound has filed for permanent disability, started meditation retreat, and achieved digital enlightenment"
1000,"The ancient ritual of Beeg detection now requires Large Hadron Collider, interdimensional portal, and miracle of friendship magic"