number,phrase
1,"🔮 BEEG SUMMONING CIRCLE ACTIVATED 🔮"
2,"Breaking news: Local man spotted in Discord for first time in 3 days"
3,"Beeg has entered witness protection program, last seen with mysterious female"
4,"EMERGENCY: Need Beeg's opinion on literally anything right now"
5,"Petition to clone Beeg so one can stay online while the other disappears"
6,"Beeg.exe has stopped working, please restart your friendship protocols"
7,"I'm starting a missing persons report, has anyone seen our beloved Beeg?"
8,"The prophecy foretells Beeg's return when the moon is full and WiFi is strong"
9,"Beeg's last online status: 'Currently downloading more personality'"
10,"BREAKING: Scientists discover new dimension where Beeg exists but can't Discord"
11,"Beeg is like a mythical creature - we have stories but no proof he's real"
12,"Plot twist: Beeg's girlfriend is actually just his alt account"
13,"Beeg's availability status: 'It's complicated (literally)'"
14,"Fun fact: Beeg's phone autocorrects 'Discord' to 'What's that?'"
15,"Beeg has achieved the ultimate camouflage: complete invisibility online"
16,"Warning: Beeg may cause sudden disappearances and relationship priorities"
17,"Beeg's superpower: Vanishing the moment love is in the air"
18,"The last person to see Beeg online won a prize (it was loneliness)"
19,"Beeg is basically Bigfoot at this point - rare sightings, blurry evidence"
20,"Dear Beeg, your Discord friends miss you more than your Netflix 'Continue Watching' list"
21,"Beeg's relationship status update also broke his online status apparently"
22,"The WiFi is strong, the server is stable, but where art thou Beeg?"
23,"Beeg's last message was 'brb' and that was 47 years ago"
24,"Initiating Operation: Remind Beeg That Friends Exist"
25,"Beeg sighting reported! False alarm, it was just his profile picture"
26,"Beeg's online presence has become an endangered species"
27,"Testing... testing... is this thing on? Can Beeg hear us from the love dimension?"
28,"Beeg's Discord status: 'Away' (and apparently staying that way)"
29,"The group chat misses its favorite ghost member"
30,"Beeg has mastered the art of quantum socializing - existing and not existing simultaneously"
31,"Emergency broadcast: Will trade memes for one (1) Beeg appearance"
32,"Beeg's dating life is thriving but his Discord game is dying"
33,"The server feels empty without our resident disappearing act"
34,"Beeg's online status is more elusive than a unicorn riding a rainbow"
35,"Breaking: Local friend discovers there's a world beyond Discord, abandons ship"
36,"Beeg's girlfriend must have really good WiFi because he never leaves"
37,"The ancient texts speak of a chosen one named Beeg who would return when needed most"
38,"Beeg's last seen: approximately when dinosaurs roamed the earth"
39,"Fun drinking game: Take a shot every time Beeg comes online (you'll stay sober)"
40,"Beeg has transcended to a higher plane of existence (his girlfriend's couch)"
41,"The mystery of Beeg's disappearance rivals that of Atlantis"
42,"Beeg's online activity is sponsored by 'Relationship Goals' and 'Social Media Detox'"
43,"Plot twist: Beeg never existed, he was just a collective hallucination"
44,"Beeg's Discord notifications are probably just digital tumbleweeds at this point"
45,"The server's most wanted: Beeg (for abandoning his post)"
46,"Beeg's stealth mode is so advanced, even ninjas are taking notes"
47,"Dear Diary: Still no sign of Beeg, beginning to question reality"
48,"Beeg's online presence has been classified as 'cryptid-level rare'"
49,"The WiFi gods demand a sacrifice to bring back Beeg (preferably memes)"
50,"Beeg's relationship > Beeg's friendships (we get it, but still...)"
51,"Breaking: Scientists study Beeg's disappearing act for teleportation research"
52,"Beeg's last online status update was written in hieroglyphics"
53,"The server's population has decreased by 100% of its Beeg content"
54,"Beeg's phone probably thinks Discord is a mythical app at this point"
55,"Emergency meeting: How to clone Beeg for consistent online presence"
56,"Beeg's dating success is inversely proportional to his Discord activity"
57,"The ancient prophecy: 'He who is called Beeg shall return when least expected'"
58,"Beeg's online status is like a solar eclipse - rare and worth celebrating"
59,"Breaking news: Local man forgets he has friends outside of romantic relationship"
60,"Beeg's Discord activity graph looks like a flatline (not dead, just in love)"
61,"The server's best kept secret: Beeg actually knows how to use Discord"
62,"Beeg's last message is now considered ancient literature by Discord historians"
63,"Fun fact: Beeg's profile picture has more online presence than Beeg himself"
64,"The group chat's missing puzzle piece: one (1) Beeg-shaped friend"
65,"Beeg's notification sound has forgotten what it sounds like"
66,"Breaking: Relationship coaches cite Beeg as example of 'healthy boundaries' (too healthy?)"
67,"Beeg's online invisibility cloak is working a little too well"
68,"The server's most endangered species: Active Beeg sightings"
69,"Beeg's last seen status is basically a historical document at this point"
70,"Emergency protocol: Send search party to girlfriend's house"
71,"Beeg's Discord karma is suffering from extended absence"
72,"The mystery deepens: How does one simply vanish from the internet?"
73,"Beeg's online presence is like a limited edition collectible - rarely available"
74,"Breaking: Local friend discovers love, forgets about Discord existence"
75,"The server's coldest case: The disappearance of Beeg"
76,"Beeg's notification badges are probably having an existential crisis"
77,"Fun game: Spot the difference between Beeg online and Beeg offline (impossible)"
78,"Beeg's last Discord activity predates the invention of sliced bread"
79,"The group chat's biggest unsolved mystery: Where in the world is Beeg?"
80,"Beeg's online status is more mythical than dragons"
81,"Breaking: Scientists discover new form of social media camouflage"
82,"Beeg's Discord icon is basically a museum exhibit at this point"
83,"The server's most wanted poster features Beeg's profile picture"
84,"Beeg's last message has achieved legendary status among chat historians"
85,"Emergency alert: Friend-shaped hole detected in Discord server"
86,"Beeg's online activity is sponsored by 'How to Disappear Completely'"
87,"The ancient art of Beeg summoning requires patience and memes"
88,"Beeg's notification sound has retired due to lack of work"
89,"Breaking: Local man achieves perfect work-life balance by eliminating online life"
90,"Beeg's Discord status: 'Temporarily unavailable (permanently)'"
91,"The server's most elusive member strikes again (by not striking at all)"
92,"Beeg's last online timestamp is now a historical landmark"
93,"Fun fact: Beeg's phone battery lasts forever because Discord is never open"
94,"The group chat's greatest magic trick: Making Beeg disappear"
95,"Beeg's online invisibility has reached professional magician levels"
96,"Breaking: Relationship success inversely affects Discord presence, local man proves theory"
97,"The server's population counter still includes Beeg (optimistically)"
98,"Beeg's last message is being preserved by the Library of Congress"
99,"Emergency meeting: Establish Beeg Memorial Discord Channel"
100,"Beeg's online presence is like WiFi in a basement - technically possible but rarely working"
101,"🕯️ Lighting a candle for Beeg's return to the digital realm 🕯️"
102,"Beeg's girlfriend must have really good snacks because he never leaves"
103,"The server's most successful witness protection participant: Beeg"
104,"Breaking: Local friend discovers offline world, immediately relocates"
105,"Beeg's Discord notifications are sending postcards from the spam folder"
106,"The ancient ritual of Beeg summoning begins with proper WiFi connection"
107,"Beeg's online status is more reliable than weather predictions (both never accurate)"
108,"Fun drinking game: Drink every time Beeg responds (designated driver guaranteed)"
109,"The server's biggest mystery: Did Beeg ever actually exist?"
110,"Beeg's last seen status has been carbon-dated to the Mesozoic era"
111,"Emergency broadcast: Will accept any Beeg-related proof of life"
112,"Beeg's relationship timeline perfectly matches his Discord absence timeline"
113,"The group chat's missing ingredient: one cup of active Beeg"
114,"Beeg's phone probably thinks his friends are fictional characters"
115,"Breaking: Scientists study Beeg's vanishing act for quantum physics research"
116,"Beeg's Discord activity level: Ghost mode (permanent edition)"
117,"The server's most dedicated lurker doesn't even lurk anymore"
118,"Beeg's online presence is like a unicorn - beautiful in theory"
119,"Fun fact: Beeg's notification count has achieved mathematical infinity"
120,"The group chat's greatest disappearing act since Houdini"
121,"Beeg's last message is now studied in communication archaeology classes"
122,"Emergency protocol: Check if Beeg's Discord still exists"
123,"Beeg's girlfriend must have Discord-blocking superpowers"
124,"The server's most successful digital detox participant (involuntary)"
125,"Beeg's online status update frequency: Once per geological era"
126,"Breaking: Local man discovers love, immediately forgets internet password"
127,"The ancient prophecy speaks of Beeg's return during server maintenance"
128,"Beeg's Discord icon is basically a historical artifact"
129,"Fun game: Find Beeg online (difficulty level: impossible)"
130,"The server's most wanted: Beeg (for crimes against friendship)"
131,"Beeg's last online activity is now considered prehistoric"
132,"Emergency meeting: How to establish diplomatic relations with Beeg's girlfriend"
133,"Beeg's notification sound has filed for unemployment"
134,"The group chat's biggest plot twist: Beeg was real all along"
135,"Beeg's online invisibility cloak is working overtime"
136,"Breaking: Relationship coaches everywhere cite Beeg as cautionary tale"
137,"Beeg's Discord status: 'Away' (since the dawn of time)"
138,"The server's most elusive cryptid: The legendary Beeg"
139,"Beeg's last message has been nominated for historical preservation"
140,"Fun fact: Beeg's phone autocorrects 'friends' to 'girlfriend'"
141,"The ancient art of Beeg detection requires advanced radar technology"
142,"Beeg's online activity graph resembles a horizontal line"
143,"Emergency alert: Beeg-shaped void detected in server atmosphere"
144,"Beeg's relationship status update broke his Discord account"
145,"The server's most successful disappearing act (no magic required)"
146,"Beeg's last seen timestamp is written in ancient runes"
147,"Breaking: Local friend achieves perfect invisibility without trying"
148,"Beeg's Discord notifications have formed their own support group"
149,"The group chat's missing puzzle piece is Beeg-shaped"
150,"Beeg's online presence is like a solar eclipse - rare and brief"
151,"🔍 BEEG DETECTION PROTOCOL INITIATED 🔍"
152,"Beeg's girlfriend must have really good WiFi AND really good snacks"
153,"The server's most dedicated offline player"
154,"Breaking: Scientists discover new dimension where Beeg exists but can't type"
155,"Beeg's last Discord activity predates the invention of the internet"
156,"Emergency broadcast: Beeg sighting reported (false alarm: was just wishful thinking)"
157,"Beeg's online status is more mysterious than the Bermuda Triangle"
158,"The ancient texts speak of a chosen one who would master the art of digital disappearance"
159,"Beeg's notification badges have achieved sentience and started their own chat"
160,"Fun drinking game: Take a sip every time someone mentions Beeg (alcohol poisoning guaranteed)"
161,"The server's coldest case file: 'The Beeg Vanishing'"
162,"Beeg's Discord activity is sponsored by 'How to Ghost Your Friends Professionally'"
163,"Breaking: Local man discovers love, immediately develops selective hearing for notifications"
164,"Beeg's online presence is like finding a needle in a haystack (if the needle could walk away)"
165,"The group chat's most successful social media detox participant"
166,"Beeg's last message is being translated by ancient language experts"
167,"Emergency protocol: Send carrier pigeon to Beeg's location"
168,"Beeg's girlfriend must have Discord-repelling superpowers"
169,"The server's most wanted poster features Beeg's 'last seen 3 months ago' status"
170,"Beeg's online activity frequency: Once per solar system alignment"
171,"Fun fact: Beeg's phone battery lasts forever due to lack of Discord usage"
172,"The ancient ritual of Beeg summoning requires three full moons and a stable internet connection"
173,"Beeg's Discord icon has more online presence than Beeg himself"
174,"Breaking: Relationship success rate inversely proportional to Discord activity, study confirms"
175,"Beeg's notification sound has taken early retirement"
176,"The server's biggest mystery: How does one simply walk away from memes?"
177,"Beeg's last online status update was carved in stone tablets"
178,"Emergency meeting: Establish Beeg Memorial Day"
179,"Beeg's online invisibility has reached professional spy levels"
180,"The group chat's most legendary ghost member"
181,"Beeg's Discord status: 'It's complicated (with being online)'"
182,"Fun game: Beeg hide and seek (he's been hiding for months)"
183,"The server's most successful digital nomad (he never returned from his journey)"
184,"Beeg's last message has been submitted to the Guinness Book of World Records"
185,"Breaking: Local friend discovers offline world has better graphics"
186,"Beeg's online presence is like WiFi in a dead zone - theoretically possible"
187,"The ancient prophecy: 'When the server needs him most, Beeg will remain offline'"
188,"Beeg's notification count has broken the integer limit"
189,"Emergency broadcast: Will trade entire meme collection for one Beeg sighting"
190,"Beeg's relationship timeline perfectly correlates with server inactivity"
191,"The server's most successful witness relocation participant"
192,"Beeg's Discord activity is more rare than finding a unicorn"
193,"Fun fact: Beeg's 'last seen' status is older than some server members"
194,"The group chat's biggest unsolved case: The Mystery of the Missing Beeg"
195,"Beeg's online status is like a mythical creature - often spoken of, never seen"
196,"Breaking: Scientists study Beeg's vanishing technique for teleportation research"
197,"Beeg's Discord notifications have started their own support group chat"
198,"The server's most elusive member has achieved legendary status"
199,"Beeg's last online activity is considered ancient history by internet standards"
200,"Emergency protocol: Check if Discord still remembers Beeg exists"
201,"⚡ SUMMONING JUTSU: BEEG ACTIVATION TECHNIQUE ⚡"
202,"Beeg's girlfriend must have really good snacks AND really good WiFi AND mind control powers"
203,"The server's most successful digital hermit"
204,"Breaking: Local man discovers love, immediately develops Discord amnesia"
205,"Beeg's online presence is like a limited edition Pokemon - extremely rare"
206,"The ancient art of Beeg communication requires smoke signals"
207,"Beeg's last message is being preserved in the Discord Hall of Fame"
208,"Emergency alert: Server experiencing critical Beeg deficiency"
209,"Beeg's notification sound has filed for workers' compensation due to lack of work"
210,"The group chat's most wanted: Beeg (reward: one genuine friendship)"
211,"Beeg's Discord activity graph looks like a flatline EKG"
212,"Fun drinking game: Mention Beeg every hour (you'll remember him but he won't appear)"
213,"The server's biggest mystery: How to make Beeg remember he has friends"
214,"Beeg's online status update frequency: Once per ice age"
215,"Breaking: Relationship coaches study Beeg as example of 'too much balance'"
216,"Beeg's Discord icon is basically a memorial statue at this point"
217,"The ancient prophecy foretells Beeg's return when memes reach critical mass"
218,"Beeg's last seen timestamp has been declared a historical landmark"
219,"Emergency meeting: How to establish contact with the Beeg dimension"
220,"Beeg's online invisibility cloak is stuck in permanent mode"
221,"The server's most dedicated lurker has stopped lurking entirely"
222,"Beeg's notification badges have achieved consciousness and started dating each other"
223,"Fun fact: Beeg's phone thinks Discord is a forgotten ancient app"
224,"The group chat's greatest magic trick: Making Beeg vanish without a trace"
225,"Beeg's online activity is sponsored by 'Professional Ghosting Techniques'"
226,"Breaking: Local friend achieves perfect work-life balance by eliminating digital life"
227,"Beeg's Discord status: 'Away' (destination: girlfriend's dimension)"
228,"The server's most successful time traveler (he went to the future and stayed there)"
229,"Beeg's last message is being studied by cryptographers"
230,"Emergency broadcast: Beeg detection satellites have found nothing"
231,"Beeg's relationship success is directly proportional to his Discord absence"
232,"The ancient ritual of Beeg summoning requires offering of quality memes"
233,"Beeg's online presence is like finding Waldo in a completely white page"
234,"Fun game: Count how many days since Beeg was last online (calculator required)"
235,"The server's coldest case: 'Where in the World is Beeg Sandiego?'"
236,"Beeg's Discord activity level: Negative infinity"
237,"Breaking: Scientists discover new form of social camouflage through complete absence"
238,"Beeg's notification sound has started a new career in elevator music"
239,"The group chat's most legendary disappearing act since magic was invented"
240,"Beeg's last online status is older than some internet memes"
241,"Emergency protocol: Send search and rescue team to girlfriend's house"
242,"Beeg's online invisibility has reached mythical proportions"
243,"The server's most wanted criminal: Beeg (for abandoning friendship duties)"
244,"Beeg's Discord icon has more personality than some active members"
245,"Fun fact: Beeg's 'last seen' status is considered archaeological evidence"
246,"The ancient prophecy: 'He who disappears completely shall be remembered always'"
247,"Beeg's notification count has broken Discord's database"
248,"Breaking: Local man discovers offline world, never returns to tell the tale"
249,"Beeg's online activity frequency: Once per planetary alignment"
250,"The server's most successful digital detox participant (permanent edition)"
251,"🌟 BEEG RESURRECTION PROTOCOL ACTIVATED 🌟"
252,"Beeg's girlfriend must have Discord-blocking force field technology"
253,"The server's most dedicated ghost who doesn't even haunt anymore"
254,"Breaking: Relationship experts cite Beeg as 'too successful at prioritizing'"
255,"Beeg's last Discord message is now taught in digital archaeology classes"
256,"Emergency alert: Critical Beeg shortage detected in server atmosphere"
257,"Beeg's online presence is like spotting Bigfoot - everyone claims it happened but no proof"
258,"The ancient art of Beeg detection requires NASA-level technology"
259,"Beeg's notification badges have formed a union and gone on strike"
260,"Fun drinking game: Every time someone asks 'Where's Beeg?' (everyone dies of alcohol poisoning)"
261,"The server's biggest unsolved mystery rivals the lost city of Atlantis"
262,"Beeg's Discord activity is more rare than a blue moon during a solar eclipse"
263,"Breaking: Local friend discovers love, immediately forgets how to use technology"
264,"Beeg's online status update timeline: Prehistoric era"
265,"The group chat's most successful vanishing act without using actual magic"
266,"Beeg's last seen timestamp has been carbon-dated to ancient times"
267,"Emergency meeting: How to negotiate peace treaty with Beeg's girlfriend"
268,"Beeg's online invisibility cloak is working at maximum efficiency"
269,"The server's most elusive cryptid has achieved legendary ghost status"
270,"Beeg's Discord icon is basically a museum piece dedicated to friendship"
271,"Fun fact: Beeg's phone autocorrects 'Discord' to 'What's that app again?'"
272,"The ancient ritual of Beeg summoning requires sacrifice of best memes"
273,"Beeg's notification sound has taken a permanent vacation"
274,"Breaking: Scientists study Beeg's disappearance technique for invisibility research"
275,"Beeg's online activity graph is flatter than Kansas"
276,"The server's most wanted: Beeg (crime: aggravated friendship abandonment)"
277,"Beeg's last message has achieved mythical status among chat legends"
278,"Emergency broadcast: Will accept any form of Beeg-related communication"
279,"Beeg's relationship timeline perfectly mirrors his Discord exodus timeline"
280,"The group chat's missing link in the friendship chain"
281,"Beeg's online presence is like finding a four-leaf clover in a desert"
282,"Fun game: Beeg bingo (impossible to win because Beeg never appears)"
283,"The server's most successful digital hermit has achieved enlightenment through absence"
284,"Beeg's Discord status: 'Away' (estimated return date: never)"
285,"Breaking: Local man masters art of being physically present but digitally extinct"
286,"Beeg's notification count has achieved mathematical impossibility"
287,"The ancient prophecy speaks of Beeg's return during the next ice age"
288,"Beeg's last online activity is considered ancient internet history"
289,"Emergency protocol: Establish Beeg Remembrance Day"
290,"Beeg's online invisibility has reached supernatural levels"
291,"The server's coldest case file grows colder by the day"
292,"Beeg's Discord activity frequency: Once per millennium"
293,"Fun fact: Beeg's profile picture has more online presence than actual Beeg"
294,"The group chat's greatest mystery: How to reverse Beeg's disappearing spell"
295,"Beeg's online status is more elusive than the meaning of life"
296,"Breaking: Relationship success directly causes Discord amnesia, local study proves"
297,"Beeg's last seen status predates the invention of emojis"
298,"Emergency alert: Server experiencing existential crisis without Beeg"
299,"Beeg's notification sound has started therapy for abandonment issues"
300,"The ancient art of Beeg communication now requires archaeological expertise"
301,"🎭 BEEG SUMMONING THEATER PERFORMANCE BEGINS 🎭"
302,"Beeg's girlfriend must have really good snacks, WiFi, AND a Discord-proof bunker"
303,"The server's most successful digital nomad forgot to send postcards"
304,"Breaking: Local friend discovers offline world has better resolution than Discord"
305,"Beeg's online presence is like winning the lottery - theoretically possible but practically never"
306,"The ancient ritual of Beeg detection requires quantum computing"
307,"Beeg's last Discord activity is being preserved by internet historians"
308,"Emergency meeting: How to establish diplomatic relations with the offline world"
309,"Beeg's notification badges have achieved sentience and started their own server"
310,"The group chat's most legendary member exists only in stories now"
311,"Beeg's Discord activity level: Schrodinger's cat (simultaneously online and offline, but mostly offline)"
312,"Fun drinking game: Take a shot every time Beeg messages first (you'll die of sobriety)"
313,"The server's biggest mystery: How does one simply walk away from friendship?"
314,"Beeg's online status update frequency: Once per cosmic cycle"
315,"Breaking: Scientists discover new dimension where Beeg exists but Discord doesn't"
316,"Beeg's Discord icon is basically a shrine to departed friendships"
317,"The ancient prophecy: 'When the WiFi is strongest, Beeg shall remain weakest'"
318,"Beeg's last message is being translated by ancient language experts"
319,"Emergency broadcast: Beeg search party reports no findings (as usual)"
320,"Beeg's online invisibility has reached professional magician status"
321,"The server's most dedicated member became most absent member"
322,"Beeg's notification sound has filed unemployment benefits"
323,"Fun fact: Beeg's 'last seen' status is older than some Discord features"
324,"The group chat's most successful witness protection participant"
325,"Beeg's online activity is sponsored by 'How to Disappear Digitally'"
326,"Breaking: Local man achieves perfect life balance by eliminating online component"
327,"Beeg's Discord status: 'It's complicated (with existing digitally)'"
328,"The server's most elusive member has transcended to legend status"
329,"Beeg's last online timestamp has been declared a historical monument"
330,"Emergency protocol: Check if Beeg still remembers his Discord password"
331,"Beeg's relationship success inversely affects his digital existence"
332,"The ancient art of Beeg summoning requires offering of premium memes"
333,"Beeg's online presence is like catching lightning in a bottle during a drought"
334,"Fun game: Find Beeg online (difficulty: nightmare mode)"
335,"The server's coldest case grows colder with each passing day"
336,"Beeg's Discord activity frequency: Once per galactic rotation"
337,"Breaking: Relationship coaches cite Beeg as 'too effective at prioritizing'"
338,"Beeg's notification count has broken the space-time continuum"
339,"The group chat's greatest vanishing act since Houdini learned magic"
340,"Beeg's online status is more mysterious than the Loch Ness Monster"
341,"Emergency alert: Server population decreased by 100% of its Beeg content"
342,"Beeg's last seen status predates the Big Bang"
343,"The ancient prophecy foretells Beeg's return when memes achieve sentience"
