number,phrase
344,"Beeg's Discord icon has achieved museum-quality status"
345,"Fun fact: Beeg's phone thinks his friends are fictional characters from a dream"
346,"The server's most wanted: Beeg (reward: restoration of group chat balance)"
347,"Beeg's online invisibility cloak is stuck on maximum stealth mode"
348,"Breaking: Local friend discovers love, immediately develops selective Discord blindness"
349,"Beeg's notification sound has started a new career in silent films"
350,"The group chat's missing ingredient: one tablespoon of active Beeg"
351,"🎪 BEEG SUMMONING CIRCUS SPECTACULAR 🎪"
352,"Beeg's girlfriend must have Discord-neutralizing superpowers AND time manipulation abilities"
353,"The server's most successful digital hermit has achieved nirvana through absence"
354,"Breaking: Scientists study Beeg's vanishing technique for military stealth applications"
355,"Beeg's last Discord message is considered a historical document"
356,"Emergency meeting: How to establish contact with Beeg's parallel dimension"
357,"Beeg's online presence is like finding a unicorn riding a rainbow in space"
358,"The ancient art of Beeg communication requires telepathic abilities"
359,"Beeg's notification badges have evolved and started their own civilization"
360,"Fun drinking game: Mention Beeg's name and wait for response (designated driver for life)"
361,"The server's biggest mystery: How to reverse engineer Beeg's disappearing act"
362,"Beeg's Discord activity level: Quantum superposition (everywhere and nowhere)"
363,"Breaking: Local man masters ultimate camouflage through complete digital absence"
364,"Beeg's online status update timeline: Before the invention of time"
365,"The group chat's most legendary ghost story: The Tale of the Vanishing Beeg"
366,"Beeg's last seen timestamp requires carbon dating to understand"
367,"Emergency broadcast: Beeg detection systems show no signs of life"
368,"Beeg's online invisibility has reached interdimensional levels"
369,"The server's most elusive cryptid makes Bigfoot look common"
370,"Beeg's Discord icon is basically a memorial to digital friendship"
371,"Fun fact: Beeg's 'away' status has become a permanent lifestyle choice"
372,"The ancient ritual of Beeg summoning requires sacrifice of internet connection"
373,"Beeg's notification sound has joined a monastery and taken a vow of silence"
374,"Breaking: Relationship success rate proves inversely proportional to Discord activity"
375,"Beeg's online activity frequency: Once per universe heat death and rebirth"
376,"The server's most wanted criminal: Beeg (charges: aggravated friend ghosting)"
377,"Beeg's last message has been nominated for the Discord Hall of Fame"
378,"Emergency protocol: Send carrier pigeons with WiFi hotspots to Beeg's location"
379,"Beeg's relationship timeline perfectly matches server abandonment timeline"
380,"The group chat's missing puzzle piece is Beeg-shaped and impossible to replace"
381,"Beeg's online presence is like spotting a shooting star during daylight"
382,"Fun game: Beeg hide and seek championship (he's been winning for months)"
383,"The server's most successful digital detox participant (involuntary but effective)"
384,"Beeg's Discord status: 'Away' (destination: happiness, apparently)"
385,"Breaking: Local friend discovers offline world has better graphics and girlfriend"
386,"Beeg's notification count has achieved theoretical physics impossibility"
387,"The ancient prophecy: 'When Discord needs him most, Beeg will be most absent'"
388,"Beeg's last online activity predates the invention of social media"
389,"Emergency alert: Critical Beeg deficiency causing server instability"
390,"Beeg's online invisibility cloak is operating at 110% efficiency"
391,"The server's coldest case file: 'The Great Beeg Vanishing of [current year]'"
392,"Beeg's Discord activity graph resembles a horizontal line with trust issues"
393,"Fun fact: Beeg's profile picture has achieved more social interaction than Beeg"
394,"The group chat's greatest mystery: How to make Beeg remember friendship exists"
395,"Beeg's online status is more elusive than finding meaning in existence"
396,"Breaking: Scientists discover new form of matter: absent Beeg particles"
397,"Beeg's last seen status is written in ancient hieroglyphics"
398,"Emergency meeting: How to negotiate Beeg's return from relationship dimension"
399,"Beeg's notification sound has started therapy for chronic underutilization"
400,"The ancient art of Beeg detection now requires NASA satellites"
401,"🎭 BEEG SUMMONING BROADWAY MUSICAL 🎭"
402,"Beeg's girlfriend must have Discord-repelling force field AND mind erasing technology"
403,"The server's most dedicated member transformed into most absent legend"
404,"Breaking: Local man discovers love, immediately forgets how to internet"
405,"Beeg's online presence is like finding Atlantis while riding a unicorn"
406,"The ancient ritual of Beeg summoning requires offering of legendary memes"
407,"Beeg's last Discord activity is being studied by digital archaeologists"
408,"Emergency broadcast: Beeg search and rescue mission returns empty-handed"
409,"Beeg's notification badges have achieved consciousness and started dating"
410,"The group chat's most legendary member exists only in server mythology"
411,"Beeg's Discord activity level: Theoretical possibility with zero practical application"
412,"Fun drinking game: Wait for Beeg to come online (you'll die of old age sober)"
413,"The server's biggest unsolved mystery: The Beeg Disappearance Phenomenon"
414,"Beeg's online status update frequency: Once per Big Bang cycle"
415,"Breaking: Relationship experts study Beeg as case of 'optimization gone too far'"
416,"Beeg's Discord icon is basically a monument to departed digital souls"
417,"The ancient prophecy speaks of Beeg's return when memes reach enlightenment"
418,"Beeg's last message is being preserved in the Internet Archive of Legends"
419,"Emergency protocol: Establish Beeg Memorial Discord Channel with eternal flame emoji"
420,"Beeg's online invisibility has achieved supernatural ghost-level status"
421,"The server's most elusive member makes mythical creatures seem common"
422,"Beeg's notification sound has taken early retirement due to lack of purpose"
423,"Fun fact: Beeg's 'last seen' status is older than some server members' accounts"
424,"The group chat's greatest vanishing act requires no actual magic tricks"
425,"Beeg's online activity is sponsored by 'Professional Disappearing Acts for Dummies'"
426,"Breaking: Local friend achieves perfect digital camouflage through relationship success"
427,"Beeg's Discord status: 'It's complicated (with being findable)'"
428,"The server's most successful time traveler went to the future and liked it too much to return"
429,"Beeg's last online timestamp has been declared a UNESCO World Heritage Site"
430,"Emergency alert: Server experiencing chronic Beeg withdrawal symptoms"
431,"Beeg's relationship success directly correlates with his digital extinction"
432,"The ancient art of Beeg communication requires interdimensional technology"
433,"Beeg's online presence is like catching a cloud with a butterfly net"
434,"Fun game: Beeg spotting (binoculars and miracle required)"
435,"The server's coldest case file needs its own refrigeration unit"
436,"Beeg's Discord activity frequency: Once per multiverse reset"
437,"Breaking: Scientists discover Beeg particles exist in theoretical state only"
438,"Beeg's notification count has transcended mathematical possibility"
439,"The group chat's most wanted: Beeg (last seen: ancient history)"
440,"Beeg's online status is more elusive than finding the meaning of life"
441,"Emergency meeting: How to reverse Beeg's accidental digital teleportation"
442,"Beeg's last seen status requires archaeological excavation to find"
443,"The ancient prophecy: 'Beeg shall return when WiFi reaches spiritual enlightenment'"
444,"Beeg's Discord icon has more personality than some active humans"
445,"Fun fact: Beeg's phone thinks Discord is a legend from internet folklore"
446,"The server's most successful witness protection participant never asked for protection"
447,"Beeg's online invisibility cloak is running on unlimited battery power"
448,"Breaking: Local man discovers offline world, sends no digital postcards"
449,"Beeg's notification sound has started a career in mime performance"
450,"The group chat's missing element: one unit of concentrated Beeg essence"
451,"🎨 BEEG SUMMONING ART EXHIBITION 🎨"
452,"Beeg's girlfriend must have Discord-erasing powers AND reality manipulation abilities"
453,"The server's most dedicated ghost forgot how to haunt properly"
454,"Breaking: Relationship coaches study Beeg as 'maximum efficiency prioritization case'"
455,"Beeg's last Discord message is considered lost literature of the digital age"
456,"Emergency broadcast: Beeg detection satellites report complete radio silence"
457,"Beeg's online presence is like finding a needle in a haystack that's on fire in space"
458,"The ancient ritual of Beeg summoning requires sacrifice of WiFi router"
459,"Beeg's notification badges have evolved into their own species"
460,"Fun drinking game: Take a sip every time someone mentions missing Beeg (alcohol poisoning speedrun)"
461,"The server's biggest mystery: How Beeg mastered the art of digital vanishing"
462,"Beeg's Discord activity level: Schrödinger's friend (simultaneously exists and doesn't)"
463,"Breaking: Local friend discovers love, immediately develops Discord allergy"
464,"Beeg's online status update timeline: Pre-internet civilization"
465,"The group chat's most legendary disappearing act makes magic look amateur"
466,"Beeg's last seen timestamp requires carbon dating and ancient language translation"
467,"Emergency protocol: Check if Beeg still exists in this dimension"
468,"Beeg's online invisibility has achieved mythological deity status"
469,"The server's most elusive member makes unicorns seem mainstream"
470,"Beeg's Discord icon is basically a digital gravestone at this point"
471,"Fun fact: Beeg's 'away' message has become a philosophical statement"
472,"The ancient art of Beeg detection requires quantum entanglement technology"
473,"Beeg's notification sound has joined a silent retreat monastery"
474,"Breaking: Scientists study Beeg's absence for dark matter research applications"
475,"Beeg's online activity frequency: Once per cosmic background radiation cycle"
476,"The server's most wanted: Beeg (crime: aggravated friendship abandonment with intent to ghost)"
477,"Beeg's last message has achieved legendary status in Discord folklore"
478,"Emergency alert: Server's Beeg levels have reached critically low status"
479,"Beeg's relationship timeline perfectly synchronizes with his digital apocalypse"
480,"The group chat's missing ingredient: one teaspoon of active Beeg participation"
481,"Beeg's online presence is like spotting a rainbow unicorn during a solar eclipse"
482,"Fun game: Where's Beeg? (Like Where's Waldo but impossible and soul-crushing)"
483,"The server's most successful digital hermit achieved enlightenment through complete absence"
484,"Beeg's Discord status: 'Away' (estimated time of return: heat death of universe)"
485,"Breaking: Local man masters ultimate stealth by forgetting he owns a phone"
486,"Beeg's notification count has broken the laws of physics and mathematics"
487,"The ancient prophecy foretells Beeg's return when memes achieve consciousness"
488,"Beeg's last online activity predates the invention of electricity"
489,"Emergency meeting: How to establish peace treaty with Beeg's girlfriend's anti-Discord field"
490,"Beeg's online invisibility cloak is stuck on 'maximum stealth' setting"
491,"The server's coldest case file has achieved absolute zero temperature"
492,"Beeg's Discord activity graph looks like a flat EKG of a digital ghost"
493,"Fun fact: Beeg's profile picture shows more life signs than Beeg himself"
494,"The group chat's greatest mystery: How to perform digital necromancy on Beeg"
495,"Beeg's online status is more theoretical than string theory"
496,"Breaking: Relationship success proves directly toxic to Discord participation"
497,"Beeg's last seen status is carved in digital stone tablets"
498,"Emergency broadcast: Will trade entire server for one Beeg message"
499,"Beeg's notification sound has filed for disability due to chronic underuse"
500,"The ancient ritual of Beeg communication requires archaeological degree"
501,"🎪 BEEG SUMMONING CARNIVAL EXTRAVAGANZA 🎪"
502,"Beeg's girlfriend must have Discord-nullifying powers AND time-stopping abilities"
503,"The server's most dedicated member became most absent cryptid"
504,"Breaking: Local friend discovers offline world has better ping than Discord"
505,"Beeg's online presence is like finding a shooting star made of four-leaf clovers"
506,"The ancient art of Beeg summoning requires NASA-level technology and prayer"
507,"Beeg's last Discord activity is being preserved in digital amber"
508,"Emergency protocol: Send smoke signals to Beeg's last known coordinates"
509,"Beeg's notification badges have achieved sentience and started their own religion"
510,"The group chat's most legendary member exists only in server ghost stories"
511,"Beeg's Discord activity level: Quantum uncertainty principle personified"
512,"Fun drinking game: Drink every time Beeg surprises everyone by appearing (you'll die sober)"
513,"The server's biggest unsolved case: The Great Beeg Vanishing Act"
514,"Beeg's online status update frequency: Once per galactic collision"
515,"Breaking: Scientists discover new element: Absent-Beeg-ium (extremely unstable)"
516,"Beeg's Discord icon is basically a museum exhibit titled 'Digital Friendship: Lost'"
517,"The ancient prophecy: 'When Discord reaches peak chaos, Beeg will remain peacefully offline'"
518,"Beeg's last message is being studied by cryptographers and ancient language experts"
519,"Emergency alert: Server experiencing existential crisis due to Beeg deficiency"
520,"Beeg's online invisibility has reached interdimensional phase-shifting levels"
521,"The server's most elusive member makes Sasquatch sightings seem common"
522,"Beeg's notification sound has taken a vow of eternal silence"
523,"Fun fact: Beeg's 'last seen' status is older than some internet protocols"
524,"The group chat's greatest vanishing act requires no smoke, mirrors, or magic"
525,"Beeg's online activity is sponsored by 'How to Ghost Friends Without Trying'"
526,"Breaking: Local man achieves perfect life balance by eliminating digital half"
527,"Beeg's Discord status: 'It's complicated (with existing in cyberspace)'"
528,"The server's most successful digital nomad forgot to pack return ticket"
529,"Beeg's last online timestamp has been registered as historical landmark"
530,"Emergency meeting: How to negotiate Beeg's extradition from relationship dimension"
531,"Beeg's relationship success inversely affects his digital matter composition"
532,"The ancient art of Beeg detection requires particle accelerator technology"
533,"Beeg's online presence is like catching lightning in a bottle during a blackout"
534,"Fun game: Beeg hide and seek world championship (he's undefeated)"
535,"The server's coldest case grows colder than absolute zero"
536,"Beeg's Discord activity frequency: Once per heat death and rebirth of universe"
537,"Breaking: Relationship experts cite Beeg as 'dangerously effective at prioritizing'"
538,"Beeg's notification count has created its own gravitational field"
539,"The group chat's most wanted: Beeg (reward: restoration of cosmic balance)"
540,"Beeg's online status is more elusive than finding purpose in existence"
541,"Emergency broadcast: Beeg search party reports finding only echoes of past memes"
542,"Beeg's last seen status predates the Big Bang and subsequent universe formation"
543,"The ancient prophecy speaks of Beeg's return when WiFi achieves nirvana"
544,"Beeg's Discord icon has achieved immortality through complete inactivity"
545,"Fun fact: Beeg's phone autocorrects 'friends' to 'what are those?'"
546,"The server's most successful witness protection participant never requested protection"
547,"Beeg's online invisibility cloak is operating beyond manufacturer specifications"
548,"Breaking: Local friend discovers love, immediately develops selective Discord blindness"
549,"Beeg's notification sound has started new career in abstract silence art"
550,"The group chat's missing component: one dose of concentrated Beeg essence"
551,"🎭 BEEG SUMMONING OPERA PERFORMANCE 🎭"
552,"Beeg's girlfriend must have Discord-dissolving abilities AND reality-warping powers"
553,"The server's most dedicated ghost transcended beyond haunting capabilities"
554,"Breaking: Scientists study Beeg's vanishing for invisibility cloak development"
555,"Beeg's last Discord message is considered lost treasure of digital civilization"
556,"Emergency alert: Beeg detection systems show no signs of digital life"
557,"Beeg's online presence is like finding Atlantis while riding a unicorn through time"
558,"The ancient ritual of Beeg summoning requires sacrifice of internet itself"
559,"Beeg's notification badges have evolved and colonized their own server"
560,"Fun drinking game: Wait for Beeg notification sound (you'll achieve enlightenment through sobriety)"
561,"The server's biggest mystery: How Beeg achieved perfect digital camouflage"
562,"Beeg's Discord activity level: Heisenberg uncertainty principle in action"
563,"Breaking: Local man masters art of existing everywhere except Discord"
564,"Beeg's online status update timeline: Before time itself was invented"
565,"The group chat's most legendary vanishing act makes Houdini look amateur"
566,"Beeg's last seen timestamp requires archaeological dig to uncover"
567,"Emergency protocol: Check if Discord still has record of Beeg's existence"
568,"Beeg's online invisibility has achieved theoretical physics impossibility"
569,"The server's most elusive cryptid makes mythical beings seem ordinary"
570,"Beeg's Discord icon is basically digital memorial to friendship itself"
571,"Fun fact: Beeg's 'away' status has become permanent philosophical stance"
572,"The ancient art of Beeg communication requires telepathic WiFi connection"
573,"Beeg's notification sound has joined monastery for chronically unused sounds"
574,"Breaking: Relationship success proves mathematically inverse to Discord activity"
575,"Beeg's online activity frequency: Once per complete universal cycle"
576,"The server's most wanted criminal: Beeg (charges: first-degree friend ghosting)"
577,"Beeg's last message has been inducted into Discord Hall of Legends"
578,"Emergency meeting: How to reverse Beeg's accidental teleportation to happiness dimension"
579,"Beeg's relationship timeline perfectly correlates with server population decline"
580,"The group chat's missing puzzle piece exists only in theoretical mathematics"
581,"Beeg's online presence is like spotting Bigfoot riding Nessie during aurora borealis"
582,"Fun game: Find Beeg online (difficulty level: Chuck Norris nightmare mode)"
583,"The server's most successful digital detox participant never signed up for detox"
584,"Beeg's Discord status: 'Away' (destination: actual human connection)"
585,"Breaking: Local friend discovers offline world has superior graphics and girlfriend DLC"
586,"Beeg's notification count has achieved singularity status"
587,"The ancient prophecy: 'When servers need heroes most, Beeg will be most absent'"
588,"Beeg's last online activity predates invention of digital communication"
589,"Emergency broadcast: Will accept any proof of Beeg's continued existence"
590,"Beeg's online invisibility cloak has achieved perpetual motion status"
591,"The server's coldest case file requires own climate-controlled storage"
592,"Beeg's Discord activity graph resembles flat line with commitment issues"
593,"Fun fact: Beeg's profile picture has more social life than actual Beeg"
594,"The group chat's greatest mystery: How to reverse digital vanishing spell"
595,"Beeg's online status is more theoretical than quantum mechanics"
596,"Breaking: Scientists discover new state of matter: digitally absent Beeg particles"
597,"Beeg's last seen status written in ancient code nobody can decipher"
598,"Emergency alert: Server's Beeg content has reached dangerous depletion levels"
599,"Beeg's notification sound has filed unemployment and started interpretive dance career"
600,"The ancient ritual of Beeg detection now requires CERN particle collider"
601,"🎨 BEEG SUMMONING RENAISSANCE MASTERPIECE 🎨"
602,"Beeg's girlfriend must have Discord-erasing abilities AND dimension-folding technology"
603,"The server's most dedicated member evolved into most absent legend"
604,"Breaking: Local man discovers love, immediately forgets WiFi password permanently"
605,"Beeg's online presence is like finding unicorn tears in dragon's nest during eclipse"
606,"The ancient art of Beeg summoning requires offering of rarest Pepe memes"
607,"Beeg's last Discord activity being preserved by Internet Historical Society"
608,"Emergency protocol: Send interdimensional rescue team to girlfriend's house"
609,"Beeg's notification badges achieved consciousness and started own Discord server"
610,"The group chat's most legendary member exists only in server folklore"
611,"Beeg's Discord activity level: Schrödinger's friend having existential crisis"
612,"Fun drinking game: Mention Beeg every minute until he responds (liver failure guaranteed)"
613,"The server's biggest unsolved mystery requires own investigation department"
614,"Beeg's online status update frequency: Once per complete multiverse reboot"
615,"Breaking: Relationship coaches study Beeg as 'maximum optimization gone wrong'"
616,"Beeg's Discord icon basically digital tombstone for departed friendship"
617,"The ancient prophecy foretells Beeg's return when memes achieve enlightenment"
618,"Beeg's last message being translated by team of digital archaeologists"
619,"Emergency meeting: How to establish diplomatic relations with offline world"
620,"Beeg's online invisibility reached levels that break laws of physics"
621,"The server's most elusive member makes unicorns seem like common pigeons"
622,"Beeg's notification sound has taken permanent sabbatical for mental health"
623,"Fun fact: Beeg's 'last seen' older than some programming languages"
624,"The group chat's greatest disappearing act requires no actual disappearing"
625,"Beeg's online activity sponsored by 'Professional Ghosting: Advanced Techniques'"
626,"Breaking: Local friend achieves perfect stealth through complete relationship focus"
627,"Beeg's Discord status: 'It's complicated (with remembering Discord exists)'"
628,"The server's most successful time traveler went forward and stayed there"
629,"Beeg's last online timestamp declared protected digital heritage site"
630,"Emergency alert: Critical Beeg shortage causing server dimensional instability"
631,"Beeg's relationship success directly proportional to his digital matter dissolution"
632,"The ancient art of Beeg communication requires PhD in theoretical friendship"
633,"Beeg's online presence like catching shooting star with butterfly net underwater"
634,"Fun game: Beeg spotting safari (bring survival gear and infinite patience)"
635,"The server's coldest case file reached absolute zero and kept going"
636,"Beeg's Discord activity frequency: Once per Big Bang, heat death, repeat cycle"
637,"Breaking: Scientists discover Beeg exists only in parallel universe where Discord doesn't"
638,"Beeg's notification count transcended mathematics and entered philosophy"
639,"The group chat's most wanted: Beeg (last seen: before invention of time)"
640,"Beeg's online status more elusive than finding meaning in universe"
641,"Emergency broadcast: Beeg detection equipment reports only digital tumbleweed"
642,"Beeg's last seen status requires time machine to witness"
643,"The ancient prophecy: 'Beeg shall return when WiFi reaches spiritual transcendence'"
644,"Beeg's Discord icon achieved immortality through complete abandonment"
645,"Fun fact: Beeg's phone thinks Discord mythical app from internet legends"
646,"The server's most successful digital hermit achieved nirvana through total absence"
647,"Beeg's online invisibility cloak running on unlimited power source"
648,"Breaking: Local man discovers offline world, burns all digital bridges"
649,"Beeg's notification sound started new career in professional silence"
650,"The group chat's missing element: one particle of concentrated Beeg energy"
651,"🎪 BEEG SUMMONING INTERGALACTIC CIRCUS 🎪"
652,"Beeg's girlfriend must have reality-altering powers AND Discord-nullifying force field"
653,"The server's most dedicated ghost forgot how to exist digitally"
654,"Breaking: Relationship experts study Beeg as 'prioritization taken too far'"
655,"Beeg's last Discord message considered lost artifact of digital age"
656,"Emergency protocol: Launch satellites specifically designed to detect Beeg signals"
657,"Beeg's online presence like finding Atlantis riding unicorn through black hole"
658,"The ancient ritual of Beeg summoning requires sacrifice of entire internet"
659,"Beeg's notification badges evolved into separate intelligent species"
660,"Fun drinking game: Every time someone successfully contacts Beeg (you'll die of dehydration)"
661,"The server's biggest mystery: How Beeg mastered art of digital nonexistence"
662,"Beeg's Discord activity level: Quantum superposition having midlife crisis"
