number,phrase
663,"Breaking: Local friend discovers love, immediately develops Discord amnesia"
664,"Beeg's online status update timeline: Pre-Big Bang primordial soup era"
665,"The group chat's most legendary vanishing act defies laws of physics"
666,"Beeg's last seen timestamp requires archaeological expedition to locate"
667,"Emergency meeting: How to negotiate Beeg's return from dimension of happiness"
668,"Beeg's online invisibility achieved theoretical impossibility status"
669,"The server's most elusive member makes Bigfoot seem like attention seeker"
670,"Beeg's Discord icon basically digital shrine to abandoned friendships"
671,"Fun fact: Beeg's 'away' message became permanent life philosophy"
672,"The ancient art of Beeg detection requires NASA and MIT collaboration"
673,"Beeg's notification sound joined support group for chronically ignored sounds"
674,"Breaking: Scientists study Beeg's absence for teleportation research"
675,"Beeg's online activity frequency: Once per complete universal reincarnation"
676,"The server's most wanted: Beeg (crime: aggravated digital abandonment)"
677,"Beeg's last message achieved legendary status in internet mythology"
678,"Emergency alert: Server's Beeg levels critically low, approaching zero"
679,"Beeg's relationship timeline perfectly synchronized with digital extinction event"
680,"The group chat's missing component exists only in theoretical physics"
681,"Beeg's online presence like spotting rainbow unicorn during solar eclipse in space"
682,"Fun game: Where's Beeg championship (undefeated hide-and-seek champion)"
683,"The server's most successful digital nomad forgot return address"
684,"Beeg's Discord status: 'Away' (estimated return: never o'clock)"
685,"Breaking: Local man achieves perfect invisibility through complete girlfriend focus"
686,"Beeg's notification count created its own pocket dimension"
687,"The ancient prophecy: 'When Discord reaches peak activity, Beeg reaches peak absence'"
688,"Beeg's last online activity predates invention of binary code"
689,"Emergency broadcast: Will trade server ownership for one Beeg appearance"
690,"Beeg's online invisibility cloak achieved perpetual energy status"
691,"The server's coldest case file needs its own ice age"
692,"Beeg's Discord activity graph flatter than two-dimensional plane"
693,"Fun fact: Beeg's profile picture shows more signs of life than Beeg"
694,"The group chat's greatest mystery: How to perform digital resurrection"
695,"Beeg's online status more theoretical than string theory mathematics"
696,"Breaking: Relationship success proves directly toxic to digital existence"
697,"Beeg's last seen status carved in primordial digital stone"
698,"Emergency protocol: Check if Beeg exists in any known dimension"
699,"Beeg's notification sound has taken vow of eternal professional silence"
700,"The ancient ritual of Beeg communication requires interdimensional translator"
701,"🎭 BEEG SUMMONING SHAKESPEAREAN TRAGEDY 🎭"
702,"Beeg's girlfriend must have Discord-dissolving powers AND time-manipulation abilities"
703,"The server's most dedicated member transformed into most absent mythology"
704,"Breaking: Local friend discovers offline world has better storyline than Discord"
705,"Beeg's online presence like finding needle in haystack that's in different universe"
706,"The ancient art of Beeg summoning requires offering of legendary rare memes"
707,"Beeg's last Discord activity preserved in digital museum of lost friendships"
708,"Emergency alert: Beeg detection systems report complete radio silence across all dimensions"
709,"Beeg's notification badges achieved sentience and started their own civilization"
710,"The group chat's most legendary member exists only in server creation myths"
711,"Beeg's Discord activity level: Quantum uncertainty principle having existential breakdown"
712,"Fun drinking game: Wait for Beeg to break his silence (you'll achieve enlightenment through sobriety)"
713,"The server's biggest unsolved case: The Phenomenon of Beeg's Digital Vanishing"
714,"Beeg's online status update frequency: Once per complete cosmic reboot sequence"
715,"Breaking: Scientists discover Beeg particles exist only in theoretical state"
716,"Beeg's Discord icon basically digital gravestone for concept of friendship itself"
717,"The ancient prophecy speaks of Beeg's return when internet achieves consciousness"
718,"Beeg's last message being studied by digital anthropologists and meme historians"
719,"Emergency meeting: How to establish peace treaty with Beeg's girlfriend's anti-Discord field"
720,"Beeg's online invisibility has transcended beyond measurable physics"
721,"The server's most elusive cryptid makes mythical creatures seem mainstream"
722,"Beeg's notification sound has filed for disability benefits due to chronic neglect"
723,"Fun fact: Beeg's 'last seen' status older than some internet memes"
724,"The group chat's greatest disappearing act makes magic look like amateur hour"
725,"Beeg's online activity sponsored by 'How to Ghost Friends: PhD Level'"
726,"Breaking: Local man masters ultimate camouflage through complete relationship immersion"
727,"Beeg's Discord status: 'It's complicated (with existing in digital realm)'"
728,"The server's most successful digital hermit achieved enlightenment through pure absence"
729,"Beeg's last online timestamp registered as UNESCO Digital Heritage Site"
730,"Emergency broadcast: Server experiencing chronic Beeg deficiency syndrome"
731,"Beeg's relationship success directly correlates with his particle-level digital dissolution"
732,"The ancient art of Beeg detection requires collaboration between NASA and CERN"
733,"Beeg's online presence like catching lightning in bottle during universal heat death"
734,"Fun game: Beeg hide-and-seek galactic championship (he's intergalactic champion)"
735,"The server's coldest case file achieved temperature below absolute zero"
736,"Beeg's Discord activity frequency: Once per complete multiverse collapse and reconstruction"
737,"Breaking: Relationship coaches cite Beeg as 'optimization paradox case study'"
738,"Beeg's notification count has created its own gravitational singularity"
739,"The group chat's most wanted: Beeg (reward: restoration of universal balance)"
740,"Beeg's online status more elusive than finding purpose in infinite cosmos"
741,"Emergency protocol: Send interdimensional ambassadors to negotiate Beeg's return"
742,"Beeg's last seen status predates Big Bang and subsequent reality formation"
743,"The ancient prophecy foretells Beeg's return when WiFi reaches cosmic enlightenment"
744,"Beeg's Discord icon achieved digital immortality through complete inactivity"
745,"Fun fact: Beeg's phone autocorrects 'Discord' to 'What's that ancient relic?'"
746,"The server's most successful witness protection participant never requested witness protection"
747,"Beeg's online invisibility cloak operating beyond known laws of physics"
748,"Breaking: Local friend discovers love, immediately forgets digital world exists"
749,"Beeg's notification sound started new career in abstract conceptual silence art"
750,"The group chat's missing ingredient: one quantum of pure concentrated Beeg essence"
751,"🎨 BEEG SUMMONING COSMIC ART INSTALLATION 🎨"
752,"Beeg's girlfriend must have reality-warping abilities AND Discord-erasing superpowers"
753,"The server's most dedicated ghost transcended beyond ability to haunt"
754,"Breaking: Scientists study Beeg's vanishing technique for matter transportation research"
755,"Beeg's last Discord message considered lost treasure of digital civilization"
756,"Emergency alert: Beeg detection equipment reports finding only echoes of ancient memes"
757,"Beeg's online presence like finding unicorn riding Nessie through wormhole during eclipse"
758,"The ancient ritual of Beeg summoning requires sacrifice of entire internet infrastructure"
759,"Beeg's notification badges evolved into separate intelligent civilization"
760,"Fun drinking game: Take shot every time Beeg surprises everyone (you'll die completely sober)"
761,"The server's biggest mystery: How Beeg achieved perfect digital nonexistence"
762,"Beeg's Discord activity level: Schrödinger's friend having dimensional identity crisis"
763,"Breaking: Local man masters art of existing everywhere except where friends are"
764,"Beeg's online status update timeline: Before concept of time was invented"
765,"The group chat's most legendary vanishing act breaks fundamental laws of reality"
766,"Beeg's last seen timestamp requires time travel expedition to witness"
767,"Emergency meeting: How to reverse Beeg's accidental teleportation to contentment dimension"
768,"Beeg's online invisibility has achieved status beyond theoretical physics"
769,"The server's most elusive member makes unicorns look like common housepets"
770,"Beeg's Discord icon basically digital monument to concept of abandoned friendship"
771,"Fun fact: Beeg's 'away' status has become permanent existential philosophy"
772,"The ancient art of Beeg communication requires PhD in theoretical digital archaeology"
773,"Beeg's notification sound joined monastery for sounds that have lost purpose"
774,"Breaking: Relationship success proves mathematically inverse to digital particle existence"
775,"Beeg's online activity frequency: Once per complete universal rebirth cycle"
776,"The server's most wanted criminal: Beeg (charges: first-degree digital abandonment)"
777,"Beeg's last message has been inducted into Internet Hall of Legendary Legends"
778,"Emergency broadcast: Will sacrifice entire meme collection for one Beeg sighting"
779,"Beeg's relationship timeline perfectly synchronizes with server's digital apocalypse"
780,"The group chat's missing puzzle piece exists only in advanced theoretical mathematics"
781,"Beeg's online presence like spotting Bigfoot riding unicorn through black hole"
782,"Fun game: Find Beeg online (difficulty level: impossible squared)"
783,"The server's most successful digital detox participant never knew he was detoxing"
784,"Beeg's Discord status: 'Away' (destination: actual meaningful human connection)"
785,"Breaking: Local friend discovers offline world has better resolution and girlfriend expansion pack"
786,"Beeg's notification count has achieved singularity and started expanding universe"
787,"The ancient prophecy: 'When Discord reaches maximum chaos, Beeg will achieve maximum peace'"
788,"Beeg's last online activity predates invention of electronic communication"
789,"Emergency protocol: Launch space mission to find Beeg in girlfriend's orbit"
790,"Beeg's online invisibility cloak has achieved perpetual motion and self-sustainability"
791,"The server's coldest case file requires its own specialized freezer unit"
792,"Beeg's Discord activity graph resembles flat EKG of digitally deceased friend"
793,"Fun fact: Beeg's profile picture has more active social life than Beeg himself"
794,"The group chat's greatest mystery: How to perform digital necromancy on living person"
795,"Beeg's online status more theoretical than quantum mechanics during fever dream"
796,"Breaking: Scientists discover new element: Absent-Beeg-onium (half-life: eternal)"
797,"Beeg's last seen status written in code that predates written language"
798,"Emergency alert: Server's Beeg content has reached dangerously critical depletion"
799,"Beeg's notification sound has filed for unemployment and started meditation retreat"
800,"The ancient ritual of Beeg detection now requires Large Hadron Collider"
801,"🎪 BEEG SUMMONING INTERDIMENSIONAL CARNIVAL 🎪"
802,"Beeg's girlfriend must have Discord-nullifying abilities AND reality-restructuring powers"
803,"The server's most dedicated member evolved into most absent cosmic entity"
804,"Breaking: Local man discovers love, immediately develops selective digital blindness"
805,"Beeg's online presence like finding Atlantis while riding unicorn through time paradox"
806,"The ancient art of Beeg summoning requires offering of ultra-rare legendary memes"
807,"Beeg's last Discord activity being preserved by Digital Heritage Foundation"
808,"Emergency alert: Beeg detection satellites report complete silence across all known dimensions"
809,"Beeg's notification badges achieved consciousness and colonized their own galaxy"
810,"The group chat's most legendary member exists only in server creation mythology"
811,"Beeg's Discord activity level: Quantum superposition having midlife existential crisis"
812,"Fun drinking game: Mention Beeg every second until response (you'll transcend sobriety)"
813,"The server's biggest unsolved mystery requires its own research institute"
814,"Beeg's online status update frequency: Once per complete cosmic consciousness cycle"
815,"Breaking: Relationship experts study Beeg as 'perfect prioritization gone too perfect'"
816,"Beeg's Discord icon basically digital shrine to lost art of friendship"
817,"The ancient prophecy foretells Beeg's return when memes achieve universal consciousness"
818,"Beeg's last message being decoded by team of digital archaeologists and philosophers"
819,"Emergency meeting: How to establish diplomatic channel with offline happiness dimension"
820,"Beeg's online invisibility has transcended known laws of digital physics"
821,"The server's most elusive cryptid makes mythical beings seem like attention seekers"
822,"Beeg's notification sound has taken permanent vow of professional silence"
823,"Fun fact: Beeg's 'last seen' status older than some fundamental internet protocols"
824,"The group chat's greatest disappearing act requires no actual magic or effort"
825,"Beeg's online activity sponsored by 'Advanced Ghosting: Master Class Edition'"
826,"Breaking: Local friend achieves perfect stealth through complete girlfriend optimization"
827,"Beeg's Discord status: 'It's complicated (with remembering what Discord is)'"
828,"The server's most successful time traveler went to future and decided to stay"
829,"Beeg's last online timestamp declared protected digital archaeological site"
830,"Emergency broadcast: Critical Beeg shortage causing server reality distortion"
831,"Beeg's relationship success inversely proportional to his digital matter density"
832,"The ancient art of Beeg communication requires PhD in theoretical friendship physics"
833,"Beeg's online presence like catching shooting star with fishing net during eclipse"
834,"Fun game: Beeg spotting expedition (bring camping gear and lifetime supplies)"
835,"The server's coldest case file has achieved temperatures beyond absolute zero"
836,"Beeg's Discord activity frequency: Once per Big Bang, universal expansion, heat death cycle"
837,"Breaking: Scientists discover Beeg exists only in parallel dimension where love doesn't affect WiFi"
838,"Beeg's notification count has transcended mathematics and entered pure philosophy"
839,"The group chat's most wanted: Beeg (last seen: before time and space existed)"
840,"Beeg's online status more elusive than finding meaning in infinite multiverse"
841,"Emergency protocol: Send interdimensional rescue team with girlfriend-negotiation specialists"
842,"Beeg's last seen status requires time machine and archaeological dig to locate"
843,"The ancient prophecy: 'Beeg shall return when WiFi reaches enlightenment and transcends physical realm'"
844,"Beeg's Discord icon achieved digital immortality through complete user abandonment"
845,"Fun fact: Beeg's phone thinks Discord is mythical application from internet folklore"
846,"The server's most successful digital hermit achieved nirvana through total online absence"
847,"Beeg's online invisibility cloak running on infinite energy source from girlfriend's love"
848,"Breaking: Local man discovers offline world, immediately burns all digital identification"
849,"Beeg's notification sound started new career in professional interpretive silence"
850,"The group chat's missing element: one atom of concentrated Beeg participation energy"
851,"🎭 BEEG SUMMONING UNIVERSAL OPERA 🎭"
852,"Beeg's girlfriend must have reality-altering powers AND Discord-dissolving force field technology"
853,"The server's most dedicated ghost forgot how to exist in digital plane"
854,"Breaking: Relationship coaches study Beeg as 'optimization taken to dangerous extremes'"
855,"Beeg's last Discord message considered lost relic of digital golden age"
856,"Emergency alert: Beeg detection equipment reports finding only digital tumbleweeds and sadness"
857,"Beeg's online presence like finding unicorn tears in dragon's nest during solar storm"
858,"The ancient ritual of Beeg summoning requires sacrifice of entire global internet infrastructure"
859,"Beeg's notification badges evolved into separate intelligent species and started own Discord server"
860,"Fun drinking game: Every time someone successfully makes contact with Beeg (you'll achieve immortality through sobriety)"
861,"The server's biggest mystery: How Beeg mastered art of existing without existing digitally"
862,"Beeg's Discord activity level: Heisenberg uncertainty principle having complete nervous breakdown"
863,"Breaking: Local friend discovers love, immediately develops Discord-specific amnesia syndrome"
864,"Beeg's online status update timeline: Pre-Big Bang primordial quantum soup era"
865,"The group chat's most legendary vanishing act defies fundamental laws of digital physics"
866,"Beeg's last seen timestamp requires archaeological expedition and time travel permit"
867,"Emergency meeting: How to negotiate peace treaty with Beeg's girlfriend's anti-technology field"
868,"Beeg's online invisibility has achieved status beyond theoretical impossibility"
869,"The server's most elusive member makes Bigfoot seem like social media influencer"
870,"Beeg's Discord icon basically digital tombstone for concept of online friendship itself"
871,"Fun fact: Beeg's 'away' message has become permanent philosophical life statement"
872,"The ancient art of Beeg detection requires collaboration between NASA, MIT, and wizards"
873,"Beeg's notification sound joined support group for chronically ignored and abandoned sounds"
874,"Breaking: Scientists study Beeg's digital absence for breakthrough invisibility cloak research"
875,"Beeg's online activity frequency: Once per complete universal consciousness reincarnation cycle"
876,"The server's most wanted criminal: Beeg (charges: aggravated digital abandonment with intent to ghost permanently)"
877,"Beeg's last message achieved legendary status in internet mythology and folklore studies"
878,"Emergency broadcast: Will trade server ownership and firstborn child for one Beeg appearance"
879,"Beeg's relationship timeline perfectly synchronized with server's complete digital extinction event"
880,"The group chat's missing component exists only in advanced theoretical quantum friendship physics"
881,"Beeg's online presence like spotting rainbow unicorn riding Nessie through wormhole during eclipse"
882,"Fun game: Where's Beeg interdimensional championship (he's undefeated across all realities)"
883,"The server's most successful digital nomad forgot return address and burned passport"
884,"Beeg's Discord status: 'Away' (estimated return time: never thirty o'clock on the 32nd of Never)"
885,"Breaking: Local man achieves perfect camouflage through complete immersion in relationship happiness"
886,"Beeg's notification count has created its own pocket universe with different physics laws"
887,"The ancient prophecy: 'When Discord reaches peak digital chaos, Beeg will achieve peak analog peace'"
888,"Beeg's last online activity predates invention of binary code and digital communication"
889,"Emergency protocol: Launch interdimensional space mission to girlfriend's orbital love field"
890,"Beeg's online invisibility cloak has achieved perpetual motion and self-sustaining energy source"
891,"The server's coldest case file needs its own specialized cryogenic storage facility"
892,"Beeg's Discord activity graph flatter than two-dimensional mathematical plane with depression"
893,"Fun fact: Beeg's profile picture shows more signs of digital life than actual Beeg"
894,"The group chat's greatest mystery: How to perform digital resurrection on living person"
895,"Beeg's online status more theoretical than string theory mathematics during fever dream"
896,"Breaking: Relationship success proves directly toxic to digital particle existence and server stability"
897,"Beeg's last seen status carved in primordial digital stone using ancient emoji language"
898,"Emergency alert: Server's Beeg content levels have reached critically dangerous depletion point"
899,"Beeg's notification sound has filed for permanent disability and started abstract art career"
900,"The ancient ritual of Beeg communication requires interdimensional translator and prayer circle"
901,"🎪 BEEG SUMMONING COSMIC CIRCUS MAXIMUS 🎪"
902,"Beeg's girlfriend must have Discord-erasing abilities AND time-space manipulation superpowers"
903,"The server's most dedicated member transformed into most absent interdimensional legend"
904,"Breaking: Local friend discovers offline world has better graphics, storyline, and girlfriend DLC"
905,"Beeg's online presence like finding needle in haystack that exists in parallel universe"
906,"The ancient art of Beeg summoning requires offering of ultra-legendary rare Pepe collection"
907,"Beeg's last Discord activity preserved in Digital Museum of Lost Online Friendships"
908,"Emergency alert: Beeg detection systems report complete radio silence across all known dimensions and realities"
909,"Beeg's notification badges achieved sentience, started own civilization, and elected their own government"
910,"The group chat's most legendary member exists only in server creation myths and bedtime stories"
911,"Beeg's Discord activity level: Quantum uncertainty principle having complete existential breakdown"
912,"Fun drinking game: Wait for Beeg to break his legendary silence (you'll achieve enlightenment through eternal sobriety)"
913,"The server's biggest unsolved case: The Great Digital Vanishing of Beeg - A Phenomenon Beyond Science"
914,"Beeg's online status update frequency: Once per complete cosmic consciousness rebirth sequence"
915,"Breaking: Scientists discover Beeg particles exist only in theoretical state of pure relationship happiness"
916,"Beeg's Discord icon basically digital shrine to lost art of online friendship and meme sharing"
917,"The ancient prophecy speaks of Beeg's return when internet achieves universal consciousness and enlightenment"
918,"Beeg's last message being studied by digital anthropologists, meme historians, and relationship philosophers"
919,"Emergency meeting: How to establish diplomatic relations with Beeg's girlfriend's powerful anti-Discord force field"
920,"Beeg's online invisibility has transcended beyond all known laws of digital and quantum physics"
921,"The server's most elusive cryptid makes all mythical creatures seem like attention-seeking social media influencers"
922,"Beeg's notification sound has filed for unemployment benefits and started professional meditation retreat"
923,"Fun fact: Beeg's 'last seen' status older than some fundamental internet protocols and programming languages"
924,"The group chat's greatest disappearing act makes professional magic look like amateur children's birthday party tricks"
925,"Beeg's online activity sponsored by 'How to Ghost Friends: PhD Level Master Class Advanced Edition'"
926,"Breaking: Local man masters ultimate stealth camouflage through complete relationship optimization and girlfriend focus"
927,"Beeg's Discord status: 'It's complicated (with remembering that digital world and friends exist)'"
928,"The server's most successful digital hermit achieved enlightenment and nirvana through pure online absence"
929,"Beeg's last online timestamp registered as UNESCO Digital Heritage Site and protected archaeological landmark"
930,"Emergency broadcast: Server experiencing chronic Beeg deficiency syndrome causing reality distortion and existential crisis"
931,"Beeg's relationship success directly and inversely correlates with his digital matter density and particle existence"
932,"The ancient art of Beeg detection requires collaboration between NASA, CERN, MIT, and interdimensional wizards"
933,"Beeg's online presence like catching lightning in bottle during universal heat death while riding unicorn"
934,"Fun game: Beeg hide-and-seek galactic interdimensional championship (he's undefeated champion across all realities)"
935,"The server's coldest case file has achieved temperatures beyond absolute zero and entered new physics realm"
936,"Beeg's Discord activity frequency: Once per complete multiverse collapse, reconstruction, and consciousness rebirth cycle"
937,"Breaking: Relationship coaches and scientists cite Beeg as 'optimization paradox case study of dangerous perfection'"
938,"Beeg's notification count has created its own gravitational singularity and started expanding into parallel universe"
939,"The group chat's most wanted: Beeg (reward: restoration of universal balance and cosmic friendship harmony)"
940,"Beeg's online status more elusive than finding purpose and meaning in infinite expanding multiverse"
941,"Emergency protocol: Send interdimensional ambassadors with girlfriend-negotiation specialists to establish peace treaty"
942,"Beeg's last seen status predates Big Bang, universe formation, and subsequent development of reality itself"
943,"The ancient prophecy foretells Beeg's return when WiFi reaches cosmic enlightenment and transcends physical existence"
